我對海洋科學很感興趣，想知道有哪些實地實習或研究課程可以讓我親自體驗海洋的奧秘？,17,1,1,1,0.1792216509504554
擁海學程有很多有趣的課程，想知道有哪些實驗或實習課程可以讓我直接接觸海洋的研究？,17,1,1,1,0.15998209573866212
我想深入了解海洋環境，我想問一下，課程中有哪些與海洋法相關的課程？,17,1,1,1,0.23751490095136982
我對海洋與海岸保護很感興趣，請問有哪些課程可以了解海洋環境與生態的保護？,17,1,1,1,0.18123572196483095
我對海洋學很有興趣，想知道哪些課程比較實用，能夠在實際工作中應用到海洋技術？,17,1,1,1,0.1321479018115711
我想參加海洋實習課程，怎麼能夠報名呢？,17,1,1,1,0.11494020275455452
我想學習海洋相關科學，擁海學程的實習課程有多樣化嗎？,17,1,1,1,0.19221461385586494
對於綠色港市微學程，我想知道該學程學習的主要目標和實用性在哪些方面？,4,0,0,0,0.013876415432131783
想學習綠色港市的概念，有關海岸開發和環境保護的課程你有推薦嗎？,4,1,1,1,0.5099448410123296
我對綠色港市很感興趣，能夠告訴我哪些課程會教導如何設計和保育港口環境嗎？,4,1,1,1,0.18110587002096437
我對綠色城市的發展很有興趣，請問有哪些課程能夠讓我學習如何開發和保育海岸，以及如何規劃綠色港市？,4,1,1,1,0.5150189428107523
有關綠色港市的課程，我想知道有哪些選擇可以幫助我了解海岸開發的相關議題？,4,1,1,1,0.5143221703649117
我對綠色港市的議題很感興趣，有沒有相關的課程可以幫助我了解海岸開發和保育的方法？,4,1,1,1,0.5113229668024188
想知道有關海岸開發和保育工程的課程內容，是否有實際案例或設計演練？,4,1,1,1,0.5548551256189254
我對綠色港市微學程很感興趣，能夠幫我了解這個學程的課程內容和實際應用嗎？,4,0,0,0,0.008588764083570472
智慧城市的課程有哪些？我對城市發展和數據分析很有興趣。,6,1,1,1,0.34115527351699804
我對智慧城市很有興趣，想知道有哪些課程可以學習如何運用數據分析來解決城市問題？,6,1,1,1,0.3710315699142515
智慧城市的數據分析方法應該有很多，是否有任何課程提供實踐性的練習？,6,1,1,1,0.3885385726663963
想了解智慧城市的實踐和挑戰，有哪些課程能夠提供相關的知識和技能？,6,1,1,1,0.19641993370904276
智慧城市相關課程似乎很有趣，我想學習如何應用數據分析於城市規劃，有哪些課程能夠提供相關的知識和實作經驗？,6,1,1,1,0.4539865300125218
看起來這個微學程很有趣，我想學習如何分析智慧城市的數據，是否有任何與都市分析相關的課程或實踐活動？,6,1,1,1,0.5927839164277696
想學習智慧城市的數據分析方法，哪些課程內容比較有趣？,6,1,1,1,0.22184178747245895
聽說智慧城市的課程很有趣，智慧運輸的應用有什麼樣的趨勢和挑戰？,6,1,1,1,0.19680126539843146
都市文化與地景微學程有什麼樣的課程能讓我更了解智慧城市的發展？,4,1,1,1,0.2333829365079365
都市文化與地景微學程的課程很有趣，我想了解更多智慧城市的發展和應用，智慧運輸系統有什麼樣的趨勢和挑戰？,4,1,1,1,0.43677156177156173
都市文化與地景微學程看起來很有趣，我想了解都市的未來發展方向，有哪些課程可以幫助我了解智慧城市和運輸系統的發展趨勢和挑戰？,4,1,1,1,0.3816666666666666
我對於智慧城市和文化地景有興趣，能不能告訴我哪些課程可以了解到智慧城市的發展趨勢和挑戰，以及文化地景的政治經濟學？,4,1,1,1,0.6791666666666667
我對都市文化和地景很感興趣，智慧城市和智慧運輸的發展如何影響都市文化？,4,1,1,1,0.7321428571428571
有關智慧城市的發展，城市設計和文化遺產的保護有什麼樣的關聯？,4,1,1,1,0.4074675324675324
我對都市文化與地景很感興趣，想知道有哪些課程可以學習智慧城市的發展趨勢和挑戰，以及如何結合文化地景的觀點來了解城市發展的政治經濟學？,4,1,1,1,0.6791666666666667
都市文化與地景微學程的課程有很多看起來很吸引人的選擇，哪些課程比較適合對城市發展有興趣的人？,4,1,1,1,0.12123449919374402
有關智慧城市和智慧運輸的課程，我想知道實際上面臨的挑戰有哪些？,2,1,1,1,1.0
我對智慧城市很感興趣，該學程有什麼課程能夠讓我更了解這個領域？,2,1,1,1,0.5
我對智慧城市的發展很有興趣，怎樣才能學到相關的實務應用？,2,1,1,1,1.0
有關智慧城市和運輸系統的課程，我想知道它們的實際應用和未來發展趨勢？,2,1,1,1,0.8333333333333333
智慧城市是一個很有趣的主題，想知道未來智慧城市會如何發展，還有什麼課題需要解決？,2,1,1,1,0.5833333333333333
聽說最近智慧城市和智慧運輸的趨勢很熱門，有沒有相關的課程可以幫我瞭解這個領域的發展和挑戰？,2,1,1,1,1.0
智慧城市發展中有哪些關鍵議題需要關注？,2,1,1,1,0.5833333333333333
想了解智慧城市的發展和未來趨勢，有哪些課程可以讓我了解相關議題？,2,1,1,1,0.5833333333333333
智慧城市的發展如何影響城市的運作？有哪些實際的案例可以參考？,3,1,1,1,1.0
您能夠告訴我智慧城市的未來發展方向嗎？,3,1,1,1,1.0
都市發展趨勢很有趣，智慧城市和智慧運輸系統都很值得研究，有沒有課程針對城市數位轉型的議題進行探討？,3,1,1,1,1.0
城市發展的趨勢變化很多，我想了解智慧城市的發展與挑戰，還有哪些相關的課程可以學習？,3,1,1,1,1.0
智慧城市的應用真的是很有趣，我想知道城市行銷裡面有沒有關於智慧城市數位轉型的課程？,3,1,1,1,1.0
城市發展最近變得很複雜，智慧城市和智慧運輸系統很有意思，但實際上有哪些課題需要解決？,3,1,1,1,0.8666666666666667
想了解智慧城市和智慧運輸的發展趨勢及挑戰，有哪些課程能夠提供相關的資訊和案例研究？,3,1,1,1,1.0
有關智慧城市與智慧運輸，我想了解在未來的城市發展中，如何利用數位技術來改善交通順暢度？,3,1,1,1,1.0
都市永續發展是一個很重要的議題，我想了解智慧城市的發展趨勢和挑戰，是否有相關的課程可以幫助我深入了解？,3,1,1,1,0.3100358422939068
我對於智慧城市的發展很感興趣，想了解更多關於智慧運輸系統的課程有哪些？,3,1,1,1,0.2181201550387597
我對智慧城市很有興趣，都市永續規劃的課程中會教會我們如何設計一個更優秀的城市嗎？,3,1,1,1,0.8095238095238094
我對智慧城市的發展很感興趣，能夠透過這個微學程了解智慧城市的發展趨勢和挑戰嗎？,3,1,1,1,0.41746031746031736
都市永續規劃很重要，我想了解智慧城市的發展趨勢和挑戰，還有什麼課程可以幫助我深入了解這個領域？,3,1,1,1,0.40093708165997316
都市永續發展是一個很重要的議題，智慧城市的發展對城市運作有什麼影響？,3,1,1,1,0.28611111111111115
都市永續規劃與管理微學程看起來很有趣，我想知道這個學程的課程主要會教學生什麼技能或知識？,3,0,0,1,0.09338235294117647
想學習關於城市發展和環境保護的課程，有沒有相關的都市永續規劃課程？,3,0,0,1,0.03307242228647644
基礎醫學數位微學程有哪些課程能夠幫助我了解人體結構和生理功能？,21,1,1,1,0.23033542975074117
我想了解微生物在疾病中的角色，且有哪些課程介紹藥物開發的過程？,21,0,1,1,0.12831024081604644
我對基礎醫學有興趣，想知道課程中哪些有關新藥開發的內容，能夠幫助我了解從藥物研發到臨床應用過程中遇到的挑戰嗎？,21,1,1,1,0.16457381626904732
我想學習醫學數位微學程，但是有一些課程的內容似乎很複雜，請問有哪些課程適合初學者？,21,1,1,1,0.1377964803303482
我想了解基礎醫學數位微學程的課程內容，是否有任何與新藥開發或生物統計相關的課程？,21,1,1,1,0.14741019173688896
這學程好像有很多與醫學有關的課程，我想學習基礎的藥理學或是新藥開發流程，哪些課程比較適合我？,21,1,1,1,0.24029433003717082
我對藥理學和生物統計感興趣，有哪些基礎課程可以幫助我了解人體結構和功能？,21,1,1,1,0.3096531681373061
基礎醫學數位微學程看起來很豐富，能夠學到很多醫學知識，但我想知道這個學程是針對什麼樣的人群設計的？,21,0,0,0,0.06650182560179488
我對老子有興趣，能介紹老子學習的路線或相關課程嗎？,2,1,1,1,0.5004488330341114
老子是非常重要的古文本，我想知道該課程會教我們如何分析和理解這些古文本的內容？,2,1,1,1,0.5111111111111111
我想學習更多關於中國古典文學的課程，老子是哪個單元的內容？,2,1,1,1,0.5009182736455464
我對中西文學比較有興趣，老子和中西戲劇比較課程會對我的學習有什麼幫助？,2,1,1,1,0.5238095238095238
我對中西文化比較很有興趣，老子和中西戲劇比較課程哪個更適合初學者？,2,1,1,1,0.7
我對中西文化的比較有興趣，老子或中西戲劇比較的課程有什麼內容？,2,1,1,1,0.75
對老子和中西戲劇比較感興趣，是否有更多有關中國古典文學或戲劇的選修課程？,2,1,1,1,0.6666666666666666
老子和中西戲劇比較課程有什麼內容呢？,2,1,1,1,0.6
我對音樂科技很感興趣，有哪些實際應用的課程可以學習？,1,1,1,1,1.0
我對音樂科技很有興趣，能不能告訴我這個學程裡有哪些課程可以學習音樂創作或音樂製作的技巧？,1,1,1,1,1.0
有關音樂科技的課程，能告訴我哪些課程比較適合對音樂感興趣的人嗎？,1,1,1,1,1.0
我對音樂科技很感興趣，有哪些課程可以學習音樂科技的基礎和應用？,1,1,1,1,1.0
我對音樂科技很有興趣，想知道有沒有課程可以學習音樂科技的應用和創造？,1,1,1,1,1.0
對音樂科技很感興趣，有沒有提供一些能夠實際學習音樂製作或應用音樂科技的課程？,1,1,1,1,1.0
聽說這個學程裡有音樂科技的相關課程，想要學習如何結合音樂和科技，能夠學到什麼新東西？,1,1,1,1,1.0
對音樂科技很有興趣，能不能介紹一下課程中會學習到哪些實際的音樂科技應用？,1,1,1,1,1.0
音樂科技真的很有趣，怎樣才能更深入地了解音樂科技的應用和發展？,1,1,1,1,1.0
我對音樂科技很感興趣，是否有課程可以學習如何應用音樂科技在實際音樂創作中？,1,1,1,1,1.0
我對音樂科技很有興趣，能否推薦一些音樂科技的基礎課程或實作課程？,1,1,1,1,1.0
我對音樂科技很感興趣，怎樣可以更深入地了解音樂科技的應用？,1,1,1,1,1.0
聽說這學程有關音樂科技，我想知道這學程的課程內容是什麼樣子的，有什麼實際的應用嗎？,1,1,1,1,1.0
我對音樂科技很有興趣，有沒有任何實作課程可以學習如何創造音樂或與音樂科技有關的專案？,1,1,1,1,1.0
我對音樂科技很有興趣，想知道這個學程能夠教會我什麼樣的實際能力或者技能？,1,1,1,1,1.0
這個學程聽起來很有意思，有沒有實作音樂科技的課程或專題可以讓我親自體驗？,1,1,1,1,1.0
我對音樂科技很有興趣，想知道這個學程能教會我什麼？,1,1,1,1,1.0
我想學習音樂科技，知道有哪些相關的課程嗎？,1,1,1,1,1.0
我想學習如何在音樂上使用科技，能不能提供一些相關的課程或工具？,1,1,1,1,1.0
想學音樂科技的基礎，怎樣才能入門？有哪些音樂科技相關的實作課程可以學習？,1,1,1,1,1.0
我對音樂科技很感興趣，請問有哪些課程可以讓我了解音樂科技的基礎？,1,1,1,1,1.0
我對音樂科技很有興趣，能不能介紹一下這個課程裡面會教會我們什麼樣的內容呢？,1,1,1,1,1.0
聽說這個微學程有關音樂科技，我想了解音樂科技的基本知識，該如何從零開始學習？,1,1,1,1,1.0
我對音樂科技很有興趣，聽說這個學程有個音樂科技的基礎課程，有沒有什麼資源可以幫助我了解音樂科技的基礎知識？,1,1,1,1,1.0
我對生物技術很感興趣，有哪些實驗課程可以學習生物分子和細胞的基礎知識？,6,1,1,1,0.22698135198135197
想學習生物技術，想知道有哪些實驗室課程可以讓我實際操作生物實驗？,6,1,1,1,0.2521660438327105
生物技術微學程有哪些實驗課程可以學習呢？,6,1,1,1,0.22040870045491642
生物技術微學程看起來很有趣，能夠學習生物化學實驗或蛋白質化學的課程有哪些？,6,1,1,1,0.41852690632110984
我對生物技術有興趣，想知道有哪些實驗課程能夠讓我直接接觸實驗室？,6,1,1,1,0.2467128427128427
生物技術微學程的課程有哪些，特別是實驗課程，我想了解一下課程內容和實習安排。,6,1,1,1,0.23498721266432765
我對生物技術很感興趣，想要深入了解生物化學實驗與蛋白質化學的內容，有哪些課程可以幫助我達成這個目標？,6,1,1,1,0.3330396103851481
我對生物技術很感興趣，但不確定哪些課程更適合我，有什麼是基礎的生物技術課程嗎？,6,1,1,1,0.1927416683230637
我對有機化學很感興趣，能否告訴我有機化學課程中會涉及到哪些實驗操作？,7,0,0,1,0.021086670034774525
有沒有課程教導高分子材料的合成和應用？,7,0,1,1,0.08196263320902274
我對高分子材料很感興趣，有沒有可以學習高分子合成與反應的課程？,7,1,1,1,0.20153368511186434
我對有機化學和高分子材料很有興趣，能否分享一些有機化學實驗的經驗或高分子合成的實用應用？,7,0,1,1,0.07137890797183118
我對高分子化學很感興趣，想知道有哪些課程能夠幫助我深入了解高分子合成與反應？,7,1,1,1,0.24590382117597467
我對高分子材料很有興趣，請問有哪些課程可以幫助我理解高分子合成和檢測的原理？,7,1,1,1,0.14802848059638857
想了解有機化學的應用在合成領域，我該從哪個課程開始學習？,7,0,1,1,0.030077190774970862
對於高分子化學這個領域，我想知道有哪些實際應用或研究方向比較熱門？,7,0,0,0,0.010845428164652322
有關食品安全的課程，我想知道哪些課程可以幫助我了解食品中可能的有害物質？,4,1,1,1,0.44378930817610057
食品安全實在很重要，我想了解如何評估食品安全性，有沒有相關的課程可以學習？,4,1,1,1,0.5111424984306341
食品安全相關的課程有很多，我想知道哪些課程更關注實踐應用？,4,1,1,1,0.5014598540145985
食品安全這個領域有很多角落，我想知道這個學程的課程主要是從實驗室檢測、化學原理還是營養安全的角度來教學？,4,1,1,1,0.626010781671159
想學習食品安全相關的課程，尤其是有關食品檢驗或營養安全的部分，有什麼推薦的選擇嗎？,4,1,1,1,0.6898529411764706
想學習食品安全的基本知識和檢測方法，有沒有相關的課程？,4,1,1,1,0.5067798762313378
有關食品安全的分析和檢測技術，我想知道學程裡面有哪些實際的應用課程？,4,1,1,1,0.5135304934109715
我對食品安全很感興趣，想知道哪些課程可以學到食品安全檢測的實際技巧？,4,1,1,1,0.4331776031712324
我對金融科技很感興趣，想知道有哪些課程可以學習金融市場分析或投資理論？,33,1,1,1,0.08163976331236336
我想學習金融科技，但不知道從哪裡入手，有哪些基礎課程可以先學習？,33,0,0,0,0.013948514326767424
我想學習金融科技的相關知識，有哪些課程比較適合金融市場和投資的實務應用？,33,1,1,1,0.05729503387380482
我想進入金融科技業，請問有哪些課程能夠幫助我學習相關的程式設計和數據分析？,33,1,1,1,0.04596750859594448
我想學習金融科技的相關課程，有哪些電腦程式設計和資料分析的課程可以幫助我了解金融市場和投資的運作？,33,1,1,1,0.11939142390969164
我對金融科技很有興趣，想知道哪些課程可以幫助我學會程式設計、資料分析和投資理論？,33,1,1,1,0.08673342111159149
我對金融科技很感興趣，想知道學程內有哪些課程針對投資與財務管理的知識？,33,1,1,1,0.08354939072610178
我想學習金融科技，想問一下有哪些課程是跟程式設計或資料分析有關的呢？,33,1,1,1,0.07854190840705333
海事工程學程的課程有很多，想知道電力電子學相關的課程有哪些，還有沒有其他和海事工程有關的課程呢？,16,0,0,0,0.055475773044300944
我想了解海事工程的電力系統部分，哪些課程比較有關電力系統的實際應用和最佳化？,16,1,1,1,0.10761347729717348
我對海事工程很有興趣，想問問有哪些相關的課程可以學習到智慧電網或電力系統最佳化的知識？,16,0,1,1,0.0844462559898761
我想學習海事工程，關於電力系統和電力電子學的課程有哪些？,16,1,1,1,0.08634396195408411
我對海事工程有興趣，想知道電力系統或智慧電網方面的課程安排是什麼？,16,1,1,1,0.08810601160419
我對電力系統的運轉和最佳化技術很感興趣，有哪些課程可以幫助我深入了解海事工程中電力的應用？,16,1,1,1,0.11276026660136369
我對海事工程很感興趣，想了解更多關於電力系統和電力電子學的知識，有沒有可以跟教授討論電力系統最佳化和自動化技術的機會？,16,1,1,1,0.1732202575671073
我對海事工程有興趣，想知道有哪些課程關於電力系統或智能電網的相關知識？,16,1,1,1,0.1510314953920653
太空科技微學程看起來很有趣，我想知道這個學程的實驗課程安排有多樣化嗎？,19,0,0,0,0.019271433568606076
太空科技的實驗課程有哪些？,19,0,0,0,0.020159059971611982
太空科技的實驗課程有很多選擇，我想知道哪些課程跟太空探索有關？,19,0,0,0,0.011934702900889214
太空科技微學程好像包含很多與電氣和機械相關的課程，有沒有機會能夠接觸到太空探索或航太工程的實作經驗？,19,0,0,0,0.02319608594604718
太空科技微學程好像有很多實驗課程，我想知道哪些課程跟實驗室實作相關？,19,0,0,0,0.01513394837579437
太空科技課程聽起來很吸引人，有什麼與太空相關的實驗或專案可以讓我們實際操作嗎？,19,0,0,0,0.020775763018912846
太空科技微學程有許多實驗課程，想問一下有哪些課程與實驗室工作相關？,19,0,0,0,0.01760460332408033
太空科技微學程似乎有很多實驗課程，我想了解如何在實驗室進行無線功率傳輸系統的實驗，需要具備什麼基礎知識？,19,1,1,1,0.09498175740751319
我對低碳設計很感興趣，能不能告訴我有關都市環境與機械設計的課程，哪些會有實作內容？,8,1,1,1,0.38433226058009057
我對低碳設計很感興趣，想知道有哪些課程能夠幫助我了解相關的城市規劃和製造技術？,8,0,1,1,0.04210151203747506
我對於低碳設計和都市環境很感興趣，是否有機會接觸到與城市規劃或建築設計有關的課程？,8,1,1,1,0.07023873054673249
我對於都市環境和低碳設計很感興趣，有哪些課程可以幫助我了解城市規劃和減少碳足跡？,8,0,1,1,0.027087031458347816
這個微學程好像融合了多個領域，想了解低碳設計和智慧製造的相關知識，有什麼實際的案例可以參考嗎？,8,1,1,1,0.1285174494729346
我對低碳設計很感興趣，了解都市環境的影響與智慧製造的實際應用，哪些課程比較有趣？,8,1,1,1,0.11097515154273238
碳流資訊盤查與低碳設計微學程的內容蠻多元化的，我想知道有哪些實際應用？,8,0,0,0,0.005851059304362589
我對低碳設計很有興趣，能否告訴我哪些課程可以學習到實際的應用技巧和設計方法？,8,0,0,1,0.03471455651354892
我想了解管理會計的應用，哪些課程可以幫助我學習會計的實際操作？,9,1,1,1,0.2856509716918486
我想進一步了解會計實務，成本會計或管理會計相關的課程哪個比較基礎呢？,9,1,1,1,0.5591658544509421
我想深入了解公司財務管理的相關知識，是否有任何專門針對財務管理的課程？,9,0,1,1,0.05394812190979997
會計學程有很多選擇，想要學習財務管理和審計的相關知識，哪些課程比較適合？,9,0,0,1,0.03975433163440907
有沒有任何會計課程是針對未來會計師考試的考生設計的？,9,0,0,0,0.04762209796333602
我想進一步學習會計管理，是否有任何課程介紹企業財務管理的實務應用？,9,0,1,1,0.12472377219371938
有關會計方面的學習，想了解企業內部的財務運作和管理，有哪些課程可以幫助我了解？,9,0,0,0,0.08851289300391636
想學會管理會計的實務應用，中級會計課程的內容大致是什麼？,9,1,1,1,0.3456858008345811
想了解如何在投資領域應用人工智慧，有哪些課程能夠教我如何運用程式設計、資料分析和投資理念？,8,0,0,1,0.026458843512118742
這學程的課程內容似乎很全面，能夠幫助我了解人工智慧在投資中的應用和實踐，有什麼樣的實習或專案讓學生可以實際操作嗎？,8,0,0,0,0.003776697836501259
我對投資有興趣，但不是專業人士，有沒有什麼課程可以幫助我了解投資市場的趨勢和風險？,8,0,0,0,0.01246666793653657
人工智慧投資微學程看起來很有趣，該課程對前置科學知識有什麼要求？,8,1,1,1,0.05473137174521544
想學習投資理論與實務，如何結合程式設計和大數據分析來做出投資決策？,8,1,1,1,0.290016428597771
我對投資和程式設計有興趣，人工智慧投資微學程中有哪些實踐性的課程可以學習？,8,1,1,1,0.16203742455816778
有關投資市場的技術應用，能夠透過程式設計來分析投資風險或尋找投資機會嗎？,8,1,1,1,0.1350245987556339
我想投資的時候很怕亂入市，請問有關如何利用程式交易或是分析投資市場的課程嗎？,8,1,1,1,0.21024499675396424
這學程裡面有關於金融創新的課程，能夠幫助我學習如何應用數據分析在金融領域嗎？,6,1,1,1,0.2547936940707596
我想進入金融科技領域，該學程有提供實際的應用案例嗎？,6,0,0,0,0.014978475223765685
想學習金融科技有哪些選擇？有關於電子商務或證券市場的課程可以幫我解釋嗎？,6,1,1,1,0.07856417366221287
我想進入金融產業，想學習如何應用數據分析和創新技術，哪些課程比較有助於提升我的競爭力？,6,1,1,1,0.06098640108921256
我想學習如何應用數據分析在金融領域，有哪些課程可以幫助我了解這個領域？,6,1,1,1,0.19816669765875575
有沒有相關金融科技的課程，可以幫助我了解金融市場的微觀結構和數據分析？,6,0,0,1,0.03650578009218897
想進入金融領域的創新發展，有哪些課程可以讓我學習金融科技的基礎和實務應用？,6,0,0,0,0.014773938197538632
有哪些課程可以學習如何利用巨量資料來分析財務數據或電子商務市場？,6,1,1,1,0.31837402690017613
我想學習如何有效管理公司的資金，是否有相關的課程可以幫助我了解財務管理的實務應用？,11,1,1,1,0.22432200847197467
想學習財務管理，希望知道哪些課程比較實用？,11,1,1,1,0.3009086000386143
我想進一步了解財務管理的理論與實務，哪些課程比較關注財務管理的實際應用？,11,1,1,1,0.13048737493021212
想學習如何管理公司的資金，財務管理課程有什麼樣的內容和實踐？,11,1,1,1,0.23056026169492447
有哪些選擇的課程可以幫助我了解財務管理的理論和實務？,11,0,1,1,0.10723331305937417
有關財務管理的課程，我想知道哪些課程能幫助我了解財務管理的實務應用和理論基礎？,11,1,1,1,0.17815779878845403
我想進一步深入財務管理的知識，怎麼樣才能找到一個適合自己學習財務管理理論與實務的課程？,11,1,1,1,0.164499080763591
我想進一步深入財務管理的知識，是否有推薦的課程能讓我了解財務管理的理論與實務？,11,1,1,1,0.17144683490388476
我對海洋生物很感興趣，想知道有哪些課程能夠讓我深入了解珊瑚的基因體或是海洋生物的演化過程？,3,1,1,1,0.39823468328141226
有關海洋生物的課程很吸引我，海洋基礎科學和珊瑚基因體學哪一個比較適合初學者？,3,1,1,1,0.41234567901234565
我對珊瑚或海洋生物很感興趣，海洋基礎科學的課程內容會有哪些？,3,1,1,1,0.13384131904085408
我對海洋生物很感興趣，有沒有相關的課程能教我基礎的海洋科學知識和珊瑚或海洋動物的演化相關內容？,3,0,1,1,0.05756613756613757
我對海洋生物很有興趣，想學習更多關於珊瑚或海洋動物的基因體學和演化，我們學程有哪些相關的課程可以選擇？,3,1,1,1,0.37203116093482796
我對海洋生物很有興趣，海洋基礎科學的課程對於進一步學習珊瑚基因體學和海洋動物演化學有幫助嗎？,3,1,1,1,0.49707602339181284
對海洋生物很有興趣，有沒有相關生物資訊的課程能夠了解珊瑚或海洋動物的演化史？,3,1,1,1,0.1883536648941716
