想深入了解人權議題，是否有相關課程探討如何透過倡議或推動社會變革？,4,1,1,1,0.5038829884636513
我想了解更多關於普世人權的課程內容，會有什麼樣的學術討論或實踐活動嗎？,4,1,1,1,0.3783321658591637
我想學習如何透過不同途徑推動人權，人權倡議和運動課程有什麼內容？,4,1,1,1,0.2564682027045633
我對人權的研究很感興趣，想知道哪些課程比較關注現代社會中的挑戰或爭議？,4,1,1,1,0.5058183838242822
想了解人權的相關議題，哪些課程能夠提供更深入的觀念和挑戰？,4,1,1,1,0.504685426912107
我對海洋生物和食品安全很感興趣，有沒有相關的課程可以學習海洋生物的多樣性和海洋產物的安全問題？,12,1,1,1,0.16134795713951572
對於海洋生物學的課程，有沒有提供實地探險或研究的機會讓我們親身體驗海洋生態和生物呢？,12,1,1,1,0.23724455701726102
我對海洋生物學很感興趣，請問有哪些課程可以讓我了解海洋生物的多樣性和生態系統？,12,1,1,1,0.2579350421756579
我想知道這個印象海味微學程的課程安排是如何的？有沒有可以提供學生實驗室實習的機會？,12,1,1,1,0.08249134308168955
有關海洋生物或食品安全的課程比較多，我想知道哪些課程有實驗或實踐的機會？,12,1,1,1,0.2372925853823162
我對海洋生物有興趣，想知道哪些課程能讓我了解海洋生物的多樣性？,12,1,1,1,0.2579350421756579
我對海洋生物很感興趣，想知道哪些課程可以讓我深入了解海洋的生物世界和生態系統？,12,0,1,1,0.07108805436516065
我對海洋生物很感興趣，能夠透過這個學程學到什麼有關海洋生態和生物的內容嗎？,12,1,1,1,0.1706905371014963
我想學習如何參與國防或了解國際事務，哪些課程比較適合我？,7,0,1,1,0.03433120887456375
全民國防微學程的課程很實用，想知道軍事訓練課程和國防政策的課程安排是怎麼樣的？,7,1,1,1,0.865079365079365
我想參加全民國防課程，但不確定哪些課程適合我，有什麼推薦的課程可以幫我選擇嗎？,7,1,1,1,0.8586626139817629
有關國防相關的課程，我想知道哪些課程與實際應用相關，能夠幫助我應對真正的危機或緊急情況？,7,1,1,1,0.28468150802621717
想學習如何參與公民防衛，請問有哪些課程可以幫助我了解相關知識和技能？,7,1,1,1,0.3838368256803051
對於全民國防微學程的課程內容有哪些選擇？有沒有提供軍事訓練和急救技巧的課程？,7,1,1,1,0.8586956521739131
我想參加全民國防課程，軍訓部分有哪些選擇？,7,1,1,1,0.8581339374203596
我想學習如何參與公共事務或國防政策，有哪些課程可以幫助我了解這些知識？,7,1,1,1,0.19981777116821453
我對國際事務和全球化很有興趣，能不能介紹一下全球研究學分學程中有關公民參與和全球政治的課程？,7,1,1,1,0.4540752712100918
我對全球政治與國際事務很有興趣，有沒有提供與全球化相關的課程或研究方向？,7,1,1,1,0.11182828812027015
我想深入了解全球政治的變化，哪些課程可以幫助我了解全球政治與經濟的互動關係？,7,1,1,1,0.2953761839978638
我對全球政治和國際事務很有興趣，哪些課程可以讓我了解不同國家的政治動態和全球化趨勢？,7,1,1,1,0.4223460140162473
想深入了解全球政治的發展，有哪些課程可以讓我更好地了解國際事務與全球化的變化？,7,1,1,1,0.3372835398601032
想深入了解全球政治與經濟關係，我該從哪些課程開始學習？,7,1,1,1,0.2953761839978638
我對全球政治很感興趣，想要了解如何參與國際事務，請問有哪些課程可以幫助我了解這方面？,7,1,1,1,0.3372835398601032
我對全球政治很感興趣，有沒有相關的課程能夠深入了解全球政治的變化和趨勢？,7,1,1,1,0.5123409996182381
有關創新創業的課程，我想知道有關如何結合社會創新和永續發展的課程嗎？,2,0,1,1,0.16233766233766234
我想學習如何結合創新創業與社會創新，能否透過這個課程了解社會創新與永續發展的關係？,2,1,1,1,0.5
我對創新創業很感興趣，想知道有沒有課程可以幫助我了解如何在社會創新中運用創造力，並且探討全球化對永續發展的影響？,2,1,1,1,0.5833333333333333
這個微學程似乎很有趣，是否有任何與企業創業或創新產業相關的課程或活動？,2,0,0,0,0.009554829094755059
這個創新創業課程看起來很有趣，如何培養創造力和應對全球化挑戰的課程會安排在課程的哪個階段？,2,0,1,1,0.11666666666666667
我想學習如何融合創新創業和社會責任，有沒有相關課程能夠幫助我了解永續發展的觀點？,2,0,0,0,0.02702702702702703
我對創新創業很感興趣，想知道這個課程會怎麼教導我們創造新的想法和解決社會問題？,2,0,0,0,0.0024480428779302885
有關創新創業的課程，我想了解如何結合創造力和社會創新，能夠幫助我在實踐中運用這些知識嗎？,2,1,1,1,0.5476190476190477
我想學習如何設計出能夠解決現實世界問題的創意方案，有哪些課程可以幫助我培養這些能力？,6,1,1,1,0.24276654885765628
我對生態與創新有很強的興趣，想知道哪些課程可以幫助我培養創造力和設計思考能力？,6,1,1,1,0.23691015958766296
想學習如何讓創新和設計思考應用在社會問題解決上，有什麼課程可以幫助我？,6,1,1,1,0.4354835507520071
我對設計思考和創新很有興趣，請問這學程的課程安排有提到實踐案例或跨域合作嗎？,6,1,1,1,0.21646154898620473
我想學習如何將設計思維應用在實際問題上，能不能找出一些有趣的課程或案例？,6,1,1,1,0.2051142977145909
我對生態與創新很有興趣，該課程有關於如何結合自然環境與創造力來解決問題的課程嗎？,6,0,0,0,0.01163910625160768
我想知道如何結合設計思考和創意思維來解決社會問題，還有哪些課程可以幫助我了解這方面的知識？,6,1,1,1,0.5013268520232245
這個微學程看起來很有趣，我想知道有沒有任何與自然環境或創新思維相關的課程？,6,1,1,1,0.0635401506747746
我對原住民族議題很感興趣，該學程有哪些課程能夠深入探討當代原住民族的問題和挑戰？,6,1,1,1,0.2024479295188347
我對原民文化很感興趣，想知道有哪些課程可以學習到原住民族的議題和永續發展相關知識？,6,0,1,1,0.05095655239890745
我對原民文化與永續發展很感興趣，有沒有課程能夠讓我深入了解原住民族的當代議題和永續發展的教育方法？,6,1,1,1,0.34957714484836894
我對原民文化和永續發展很感興趣，想知道有哪些課程可以學到原住民族的議題和文化地景的管理？,6,0,0,1,0.05576330551339428
我對原民文化很有興趣，想知道這個學程會教導我們什麼樣的社會創新或永續發展實踐？,6,0,1,1,0.0657107204028557
我對原民文化議題很感興趣，想知道學程有哪些課程能夠深入探討原住民族的議題和永續發展的實踐？,6,1,1,1,0.3400958421890481
我對原民文化很有興趣，想知道學程中有關永續發展的課程有哪些？,6,0,0,0,0.030268582683196477
原民文化探索及永續發展學程似乎很有趣，有關於如何在實際的社區中實踐永續發展的課程或實踐經驗嗎？,6,0,0,1,0.034685980826008926
我對海洋國家公園很感興趣，請問這個學程中，我可以學到什麼關於海洋生態和生物多樣性的知識？,6,1,1,1,0.2755617538226233
我對海洋國家公園很有興趣，了解海洋生態與科技有什麼相關的課程嗎？,6,1,1,1,0.23731326704466563
有沒有關於海洋國家公園的課程？想了解海洋生態系統和國家公園管理的相關知識。,6,1,1,1,0.21588807491640274
我對海洋生物多樣性很有興趣，探索海洋國家公園的課程中會有相關的內容嗎？,6,1,1,1,0.202441487401829
我對海洋國家公園很感興趣，有沒有任何課程提供實地探險或海洋生態觀察的機會？,6,1,1,1,0.26730527763026074
有關海洋國家公園的課程，能告訴我哪些課程會讓我了解海洋生態系統和保護工作？,6,1,1,1,0.21012826012826014
聽說這個學程可以學到海洋生物的多樣性，和海洋國家公園的保護有關，我想知道這個學程中會學到哪些實用的技能和知識？,6,1,1,1,0.23966397805223716
我對海洋國家公園很感興趣，能否透過這個課程學習到如何保護海洋生物多樣性和國家公園的經營？,6,1,1,1,0.14824904938433794
我對永續農業有興趣，想知道這個學程會教會我什麼樣的在地永續發展方法和全球觀點？,6,1,1,1,0.34053362759120115
我對於農業永續發展很有興趣，想了解如何結合在地食物、都市農業和環境政策，請問有哪些課程可以幫助我了解這些相關議題？,6,1,1,1,0.4582797623167248
對於永續農業的課程有什麼選擇？,6,1,1,1,0.3431486089033258
有關永續農業的課程，我想知道有沒有學習都市農業的選擇，或者有沒有課程探討在地食物的永續發展？,6,1,1,1,0.34468177544066037
最近關注永續發展議題，想知道學程中哪些課程能夠讓我更深入了解在地食物的重要性？,6,1,1,1,0.33818302791557925
想學習如何結合農業、環境保護和社區發展，哪些課程比較相關呢？,6,1,1,1,0.23634222038983943
我對永續農業很感興趣，想知道學程中哪些課程與在地食物和都市農業有關？,6,1,1,1,0.3397601201202227
我對永續農業很有興趣，希望能了解在地食物的永續發展與全球脈絡的課程內容和實作方式有什麼樣的安排？,6,1,1,1,0.3471688605953687
我想參與學程的實踐課程，有什麼服務學習或實作項目可以讓我與科學家一起合作？,14,1,1,1,0.04019827261765953
我對於科學的本質很感興趣，怎樣可以在這個課程中了解更多關於科學思考的方法和實作？,14,1,1,1,0.07778957018473456
我想知道這個微學程的主要焦點在於什麼？會教學生如何應用科學知識來解決環境問題嗎？,14,1,1,1,0.0905823266433172
聽說這個微學程很好，能夠學習到很多與環境和科學相關的知識，有沒有提供任何實作或實地探索的課程讓我們體驗科學的魅力？,14,0,0,1,0.028979409822191955
我想學習如何透過數據分析來了解人類對環境的影響，有哪些相關課程可以幫助我掌握這些技巧？,14,1,1,1,0.1553779202386312
這個微學程似乎結合了環境、科學和英語的內容，很吸引人。我想知道哪些課程比較適合初學者？,14,1,1,1,0.20413800642211338
我想學習環境健康相關的課程，但聽說有許多課程重疊，我們有哪些選擇可以學習海洋生物或環境健康的基礎知識？,14,1,1,1,0.21352729913880256
我對環境保護很感興趣，想了解科學與實踐的關係，有哪些課程可以幫助我了解科學思考和實作的關係嗎？,14,1,1,1,0.0936886025412915
我對臺灣海岸的環境保護很感興趣，有什麼課程能夠讓我了解海洋生態、環境政策和海岸開發的平衡嗎？,10,0,1,1,0.0546015224360213
想了解更多關於海岸微觀察的課程，是否有任何與海洋生態或海洋科技相關的實驗或探索式課程？,10,1,1,1,0.11750654100357798
聽說這個學程關於海岸的環境保護，有哪些實際的工程案例和實踐體驗可以參加？,10,1,1,1,0.1595223933455394
看見臺灣海岸微學程的課程似乎很豐富，有沒有相關的實習或探險活動讓學生親身體驗海岸微觀世界的奧秘？,10,1,1,1,0.16542053586353195
這個學程看起來很有趣，我想知道這些課程都會教我們怎麼樣保護海岸環境？,10,1,1,1,0.2299495696753399
看見臺灣海岸微學程很吸引人，我想知道該課程中會教導學生什麼樣的海洋知識以及如何應用在地球科學上？,10,1,1,1,0.13506723121684316
我對臺灣海岸的環境議題很感興趣，能夠透過課程了解海洋地質、生態系統以及海岸開發的平衡嗎？,10,1,1,1,0.2922807999241164
我想了解臺灣海岸的環境保護和資源管理，是否有相關的課程可以學習？,10,0,1,1,0.04069099828017806
我對氣候變遷很感興趣，想要了解地球科學的基本知識，有哪些入門課程可以選擇？,20,1,1,1,0.3842174776184362
我想了解氣候變遷的相關課程，有沒有包含實地探勘或研究氣候變遷的課程？,20,1,1,1,0.28208785614570325
我想學習氣候變遷的相關課程，哪些有關地球科學和環境保護的課程比較有幫助？,20,1,1,1,0.3840379560049356
我想學習氣候變遷相關課程，哪些有關環境倫理、政策或人類與環境交互關係的課程比較適合？,20,1,1,1,0.39846910240884564
氣候變遷的問題越來越嚴重，想了解如何應對和減緩氣候變遷，有哪些相關的課程或資源可以幫助我？,20,1,1,1,0.26014473561021845
氣候變遷的議題非常重要，我想知道哪些課程能夠教導我如何分析氣候變遷的影響和實踐環境保護？,20,1,1,1,0.2201176081676318
我對氣候變遷和調適很感興趣，但不確定該選哪些課程，有推薦的學分學程路線或相關選課建議嗎？,20,1,1,1,0.19147770337686681
對於氣候變遷這個問題，我想知道有哪些課程可以讓我更深入地了解地球科學與環境政策的關聯？,20,1,1,1,0.30569450837056467
想了解熱帶海洋的生態系統，哪些課程會有相關的內容？,8,0,0,0,0.02608149905693698
熱帶海洋微學程中有哪些課程能夠幫助我了解海洋生態系統和生物？,8,0,0,0,0.032094072277912965
我對熱帶海洋微的海洋生態與科技很感興趣，該學程中有哪些課程會探討海洋生態的保護與維護？,8,1,1,1,0.14951309528633455
熱帶海洋微學程的課程好像跟地球科學有關，是否有相關的實地探險活動或研究計畫可以參加？,8,0,0,1,0.033664619239129334
我對海洋生物很有興趣，有沒有相關課程可以學習海洋生態與海洋科技的應用？,8,1,1,1,0.1513765820099778
我對海洋生物很感興趣，想知道有哪些課程可以學習海洋無脊椎動物的知識？,8,1,1,1,0.04283586492565387
熱帶海洋學程有哪些課程能夠讓我了解海洋生態與海洋科技？,8,1,1,1,0.19606278894547713
我對海洋生物很有興趣，想知道熱帶海洋微學程裡有哪些課程會涉及到海洋生物的研究？,8,0,0,0,0.020989205130689123
我想知道實踐環境教育微學程中會有什麼樣的實地活動，能夠讓我們更深入地了解海洋生態和氣候變遷？,3,0,0,0,0.02859898442480226
我想參與實踐環境教育微學程，是否有機會參加海洋探險或氣候變遷調適實踐項目？,3,0,0,0,0.007752987698136559
我想參與實踐環境教育的課程，但有沒有與海洋科技有關的課程可以選擇？,3,1,1,1,0.3384476152341143
我對於海洋和氣候變遷很感興趣，有沒有機會參與實地探究或服務學習相關的課程？,3,0,0,0,0.028570005794582066
這個微學程聽起來很有趣，有沒有任何與自然環境或科學教育相關的課程，希望能夠讓我更了解這個領域？,3,0,0,0,0.019021907525508485
實踐環境教育微學程聽起來很有趣，能不能跟我分享一下這個學程的實際應用和實驗機會？,3,0,0,0,0.011524731598050697
實踐環境教育的課程有哪些？能夠教會我如何參與環境保護嗎？,3,0,0,0,0.01241587670950211
有沒有課程介紹如何通過實踐來教學生了解氣候變遷？,3,0,1,1,0.04188940613489069
我對海洋生物很感興趣，有沒有相關的實地考察或實習機會？,22,1,1,1,0.17970596043868933
我想深入了解海洋生物的多樣性，請問有哪些課程可以幫助我了解海洋生物的生態系統？,22,1,1,1,0.3077873035668139
我對海洋生物很有興趣，有沒有推薦有關海洋生物或海洋生態的實驗課程或實地探險課程？,22,1,1,1,0.12010476312934153
我對海洋生物很感興趣，想知道有哪些課程可以學習海洋生物的生態系統與保育工作？,22,1,1,1,0.25236980575052587
我對海洋生物很有興趣，想知道哪些課程能讓我深入了解海洋生態和生物多樣性？,22,1,1,1,0.3077873035668139
我想參與生物多樣性學程的實地探究活動，有機會接觸到臺灣的海洋生物或野生動物嗎？,22,1,1,1,0.1638705617368109
我想學習更多關於海洋生物的知識，有哪些課程可以讓我了解海洋生態系統和臺灣的海洋生物多樣性？,22,1,1,1,0.1748080022120764
我對海洋生物和生態學很有興趣，有沒有建議我從哪些課程開始學習？,22,1,1,1,0.16422574662191272
我對企業的社會責任和環境政策很感興趣，有沒有課程可以教導如何做出更綠色的決策？,15,1,1,1,0.14294975748618963
我想學習企業社會責任相關的課程，能否提供一些與企業溝通、環境政策、永續發展相關的課程資訊？,15,1,1,1,0.08465250738952251
我想學習如何讓企業更有社會責任，哪些課程可以幫助我了解企業的環境政策與永續發展？,15,1,1,1,0.15435135108703782
我想了解企業如何應對環境問題，有哪些課程針對企業社會責任的實務操作？,15,1,1,1,0.13673328306375157
有沒有提供一些企業如何實踐社會責任的實際案例？,15,1,1,1,0.11516017785049093
我對企業社會責任有很大的興趣，想知道哪些課程能夠教會我如何在實際工作中運用這些知識？,15,1,1,1,0.11759637635852442
我想了解企業如何面對環境問題，還有社會責任的實踐，哪些課程可以幫助我了解相關知識？,15,1,1,1,0.14109050858737587
我對企業的社會責任感很強，想知道有哪些課程可以學習企業如何更好地與環境和社會溝通？,15,1,1,1,0.1577948278845284
關於環境科技，我對生態系統保護很感興趣，哪些課程可以幫助我了解環境管理的基本原則和實踐？,13,1,1,1,0.252114353833465
想了解如何管理環境污染，環境管理相關的課程有哪些選擇？,13,1,1,1,0.240902679387775
想了解如何應對環境問題，是否有相關的實踐經驗或實驗室課程可以參與？,13,1,1,1,0.1161796810376287
我對環境科技很感興趣，想問問有哪些課程可以學習如何處理廢棄物和污染問題？,13,1,1,1,0.3468825735104628
我對環境保護很感興趣，想知道這個學程會教怎麼樣應對環境污染和資源管理問題？,13,1,1,1,0.3358466957639097
我對環境保護很感興趣，想知道有哪些課程可以教我如何應對污染問題和保護海洋資源？,13,1,1,1,0.1592060437499289
我對環境保護很感興趣，想知道環境科技與管理學程裡有哪些課程關於污染防治和生態學？,13,1,1,1,0.26565428072645286
想學習如何保護地球，我想問一下有哪些課程能教會我如何減少廢棄物或處理污染問題？,13,1,1,1,0.3852433202573957
想學習企業社會責任的相關課程，能否介紹一些環境政策或企業的公共事務管理課程？,18,1,1,1,0.12442877178499241
對於企業社會責任的學程，我想了解實際的應用和實踐，有沒有相關的課程或專題研究機會？,18,1,1,1,0.07694800913145221
我想進一步了解企業對環境的影響，有哪些課程針對企業的環保實踐與社會責任？,18,1,1,1,0.11398838115254306
我對企業的社會責任很感興趣，想知道有哪些課程可以學習企業如何面對環境問題或實踐社會責任？,18,1,1,1,0.19173128699298594
我對企業社會責任很感興趣，想知道這個學程有沒有相關的實踐課程可以學習？,18,1,1,1,0.1458717104020985
我對企業的社會責任很感興趣，有哪些課程能夠教導如何通過企業交流與社會責任實踐，做出真正的社會貢獻？,18,1,1,1,0.1286310891974471
我想了解如何讓企業更環境友善，有哪些相關課程能夠幫助我學習企業社會責任的實踐？,18,1,1,1,0.1392353742163233
我對企業社會責任很感興趣，想知道這個學程能夠幫助我學習哪些相關的理論和實踐？,18,1,1,1,0.16398667642260925
我對智慧港埠很感興趣，能否告訴我有哪些課程關於智慧運輸系統或智慧製造技術？,5,1,1,1,0.484997166555046
智慧港埠學程有哪些實踐性的課程可以讓我實際接觸到港埠相關的技術和應用？,5,0,1,1,0.16967922835352173
港口的智慧化應用實在很有趣，我想了解智慧型運輸系統或智慧製造有哪些實際應用？,5,1,1,1,0.6024157842338673
聽說智慧港埠微學程有很多有趣的課程，我想知道有沒有機會參加實習或者實地體驗，能不能告訴我相關資訊？,5,0,0,0,0.03560048559761616
智慧港埠微學程似乎與新興的科技技術有關，我想了解智慧型運輸系統和智慧製造有哪些實際應用和發展趨勢？,5,1,1,1,0.5225081335100615
我對智慧港埠的應用很有興趣，智慧型運輸系統和智慧製造技術哪一個更適合初學者學習？,5,1,1,1,0.5521561771561772
智慧港埠微學程的實習有什麼樣的安排？,5,0,0,0,0.0087529407525198
智慧港埠微學程聽起來很有意思，能夠透過實習經驗學習海上的智慧運輸系統嗎？,5,1,1,1,0.3704805642435642
我想學習如何管理污染和保護環境，有哪些課程可以幫助我了解永續發展的理念和實踐？,6,1,1,1,0.5322931697931698
想學習如何做出環保的企業，永續報告書寫作和綠色管理的課程對於這方面有幫助嗎？,6,1,1,1,0.8416666666666667
我對環境保護很有興趣，永續發展的課程有哪些選擇？,6,1,1,1,0.09767236458104206
我對於如何在實際工作中應用永續管理的知識很感興趣，有沒有相關的課程或實踐經驗可以分享？,6,1,1,1,0.1788476788476788
有關永續發展的課程比較多，我想知道怎麼樣才能更好地將所學的理念應用在實際工作中？,6,0,0,0,0.02857452785273827
我對環境保護和永續發展很有興趣，有沒有相關的課程可以學習如何寫永續報告書？,6,1,1,1,0.20792558248774773
關於永續管理，想知道如何寫出有效的環境報告書，哪些課程可以幫助我？,6,1,1,1,0.5425679832656576
我對環境保護很感興趣，想學習如何寫永續報告書，該如何開始？,6,1,1,1,0.3477703455964325
我對公民參與很感興趣，設計思考是什麼？該課程能教會我怎麼樣更好地推動公共政策或社區發展？,11,1,1,1,0.48930029427411326
這個微學程的課程內容很廣泛，有沒有提供一些基本的參與設計思考的實踐經驗或工作坊？,11,1,1,1,0.19584907913176786
我對設計思考很有興趣，能不能介紹一下與設計思考相關的課程或實踐？,11,1,1,1,0.26422917096172777
我想了解設計思考的實際應用，如何能夠結合這些理念來推動社會創新或永續發展？,11,1,1,1,0.4612074484076492
我想進一步了解設計思考的應用，能不能提供一些實際案例或是如何在公共政策領域中運用設計思考的資源或教學資源？,11,1,1,1,0.3811820684309307
我對公共事務與設計思考很有興趣，能不能介紹一些有關公共政策分析或地方創新課程？,11,1,1,1,0.23539014038040096
我對公民參與與永續發展很感興趣，設計思考或公共政策分析課程會對我有什麼樣的幫助？,11,1,1,1,0.575383305461304
我對公民參與的設計思考很感興趣，能不能提供一些有關設計思考實踐的課程或實驗？,11,1,1,1,0.3590431703820514
有關智慧城市的課程，我想知道哪些課程會涉及到數據分析或是城市規劃方面的知識？,14,1,1,1,0.4048233366306987
我對智慧城市的數據分析和運輸系統很感興趣，有沒有可以從基礎入手學習的課程？,14,1,1,1,0.4809026853934135
我對智慧運輸系統很感興趣，請問這個課程的實際應用場景和未來發展趨勢？,14,1,1,1,0.3654978980885075
我對智慧城市很有興趣，想知道在這個學程中，會教會我們怎麼樣應用數據分析方法來了解都市的結構和運作嗎？,14,1,1,1,0.4099508119037428
我想了解智慧城市與智慧運輸的發展趨勢及課題，請問有哪些課程能夠讓我了解這些議題？,14,1,1,1,0.37713821649664375
有關智慧運輸系統的課程，我想知道哪些是基礎的部分和更進階的部分？,14,1,1,1,0.33648118104452474
我對智慧城市的發展很感興趣，想知道有哪些課程可以了解城市數據分析和治理的方法？,14,1,1,1,0.3145641130974012
我對智慧城市的數據分析很感興趣，有哪些課程可以學習到如何應用數據分析方法來了解都市的運作？,14,1,1,1,0.24028482492706568
我對智慧型運輸系統很有興趣，請問有哪些課程可以讓我了解智慧城市與運輸的發展趨勢和挑戰？,5,1,1,1,0.8010482180293501
有關智慧運輸系統的課程，是否有任何涉及實際應用或案例研究的課程？,5,1,1,1,0.8025575447570332
公共交通方面有許多新技術出現，能不能教我了解智慧型運輸系統和智慧城市的相關知識？,5,1,1,1,0.8008012820512821
我對智慧運輸系統很有興趣，是否有課程會教學生如何設計或開發智慧運輸系統相關的程式？,5,1,1,1,0.8151515151515152
這個微學程聽起來很有趣，關於智慧城市和運輸系統的課程有哪些？,5,1,1,1,0.801733102253033
我想了解智慧運輸系統的實際應用，學校有提供實作課程或專案教學嗎？,5,1,1,1,0.8074626865671641
