query,ground_truth_size,Hit@5,Hit@10,Hit@20,AP
我想學習環境教育，請問這個學程中有哪些課程可以幫助我了解海洋環境和生態系統？,116,1,1,1,0.23189579985565817
我想學習環境科學，請問有哪些課程可以了解海洋與地球的關係？,116,1,1,1,0.2896528558623003
我想學習環境教育，但覺得有很多課程都跟環境有關，請問哪些課程是最基本的？,116,1,1,1,0.25451853835143784
我對環境教育很感興趣，有沒有提供多樣化的選擇讓我學習不同領域的課程？,116,1,1,1,0.25451853835143784
我對環境教育很感興趣，想知道哪些課程可以幫助我了解海洋環境的保護和永續發展？,116,1,1,1,0.284174022549515
我想了解如何在實踐中應用環境教育的理論，是否有實地實習的課程或專案可以參與？,116,1,1,1,0.2454107664767754
我想學習環境教育的相關課程，但不知道哪些課程適合我，能否推薦一些基礎的環境科學課程或是相關的實驗課程？,116,1,1,1,0.23770616561425478
我對環境科學很感興趣，請問有哪些課程可以幫助我了解海洋生態系統和海洋保護？,116,1,1,1,0.24508470353567705
有關性別研究，我想了解性別教育在實踐上的應用，哪些課程提供相關的實踐經驗？,9,1,1,1,0.3602345298664127
我想深入了解性別在社會和管理上的影響，有哪些課程可以幫助我了解這些問題？,9,1,1,1,0.30907707072418966
我對性別研究很有興趣，想了解這個領域的課程有哪些能夠幫助我了解性別議題和社會現象？,9,1,1,1,0.23908017905657436
性別研究學程看起來很有趣，我想知道這個學程是如何結合跨學科的理論和實踐呢？,9,1,1,1,0.25656238580896074
我對性別研究很有興趣，是否有課程能夠教導如何推動性別友善的校園環境？,9,1,1,1,0.29768605853054675
我對性別研究很感興趣，想了解如何促進學校環境的性別友善，我有哪些課程可以學習？,9,1,1,1,0.3602345298664127
對於性別研究學程，我想了解如何實際應用性別理論於社會，我有哪些課程選擇？,9,1,1,1,0.3969114219826142
我對性別研究很有興趣，想要學習如何推動性別友善的校園環境，有什麼課程可以幫助我？,9,1,1,1,0.384850904451204
有關跨國遷移和性別教育的課程，是否可以透過實際案例來探討這兩個議題？,4,1,1,1,0.6118589743589743
我想了解如何促進校園環境更友善，我有沒有機會參加相關的服務學習計畫或課程？,4,0,0,1,0.02450160282396378
有關跨國移民的課程有怎麼樣的內容和實作？,4,1,1,1,0.25104900850527107
我想進一步了解跨國遷移對不同性別群體的影響，有相關的課程或研究機會嗎？,4,1,1,1,0.48011363636363635
我想進一步了解跨國遷移的課程內容，能夠透過實際案例學習嗎？,4,1,1,1,0.2515218550970574
我對性別議題很感興趣，有哪些課程可以了解性別教育和性別在社會中的影響？,4,1,1,1,0.3863960113960114
有關性別教育，我想了解如何在實際的生活環境中推廣性別平等，有沒有相關的課程或活動可以參加？,4,1,1,1,0.4575892857142857
我對於性別議題很感興趣，有沒有提供跨國遷移的課程或者實習機會？,4,1,1,1,0.39954974271012006
想了解如何促進性別平等的實際應用，該微學程有什麼樣的實踐或服務學習課程可以參與嗎？,5,1,1,1,0.6036796536796537
我想進一步了解性別教育的課程內容，是否有實作或實驗部分，讓我們能夠更深入地了解這個議題？,5,1,1,1,0.571517027863777
我對性別教育很感興趣，有哪些課程可以幫助我深入了解性別的影響和推動性別平等？,5,1,1,1,0.4253703703703703
我想了解性別在工作環境中的重要性，有沒有課程探討這方面的知識？,5,1,1,1,0.3635789017184366
我想了解性別教育和管理的課程，能不能給我一些有關性別議題的學習計畫？,5,1,1,1,0.6285714285714286
這個微學程對性別議題的探討非常豐富，能夠提供一些有關性別教育、性別與管理、性別與社會的實踐課程嗎？,5,1,1,1,0.5536866359447004
我想了解如何在工作中推動性別平等，該微學程中有什麼樣的課程或實踐活動能夠幫助我？,5,1,1,1,0.5936635944700461
我對性別議題很感興趣，有沒有提供課程或活動讓我了解性別在企業或社會中的影響和應用？,5,1,1,1,0.567119589271488
聽說這個微學程關注永續發展教育，想了解更多實際的實作經驗，哪些課程可以幫助我學習？,11,1,1,1,0.24648273204092633
我對永續發展議題很感興趣，是否有課程能夠讓我了解如何將設計思考與創意設計方法應用於實際的環境保護問題？,11,1,1,1,0.07168091451428701
我對永續發展議題很感興趣， STREAM微學程的課程安排是什麼樣的？,11,0,0,0,0.005729344169585785
我想了解如何在實際生活中運用設計思考，是否有任何相關的實作課程或工作坊？,11,1,1,1,0.08442146438667672
我想了解如何將設計思考應用在實際的永續發展問題上，哪些課程或實作有助於學習這個領域？,11,1,1,1,0.10788271670601844
我對永續發展議題很感興趣，想了解這些課程是如何結合實踐和研究的？,11,1,1,1,0.1111996766301158
這個學程裡有很多跟環境保護和設計思考相關的課程，我想知道哪些課程會更深入地探討永續發展的實際應用？,11,1,1,1,0.08569641544198385
我想了解如何結合設計思考和創意設計方法來推動永續發展，有什麼課程或實踐活動可以參與嗎？,11,1,1,1,0.35578044469394104
這個跨域應用整合學程好像有很多有趣的課程，請問有哪些課程可以幫助我提高中文寫作和表達能力？,34,0,1,1,0.024415841748610424
我想學習中文創意跨域應用整合，想知道有哪些課程可以幫助我提高中文思辨和表達能力？,34,0,1,1,0.06266061850243528
我想學習中文創意跨域應用整合的課程，有哪些選擇能夠幫助我提高中文思辨和表達能力？,34,0,0,1,0.02827147194026767
我想學習中文創意跨域應用整合學程，但有很多課程名稱都很長，我想知道哪些課程比較適合初學者？,34,0,1,1,0.03064140374128006
我想在學程中學習如何結合中文和創意，請問有哪些課程能夠幫助我培養創意思維和跨域應用能力？,34,0,1,1,0.05405933820293101
我想學習中文創意跨域應用整合的課程，有哪些可以培養我批判性思維和表達能力的選擇？,34,0,0,0,0.07196579510861696
我對中文創意跨域應用很感興趣，想了解這個學程的核心內容和課程安排，請問哪些課程比較重要或有助於學習？,34,0,0,1,0.06672797521883422
我想學習如何用中文表達自己的想法，有哪些課程可以幫助我提高中文思辨能力和表達技巧？,34,1,1,1,0.06570333323526144
對海洋休閒運動產業很感興趣，想知道哪些課程能夠讓我學會初級潛水或帆船技術？,19,1,1,1,0.8594217981762019
我想學習海洋休閒運動相關的課程，但不太確定哪些是初學者的好選擇，能給我一些建議嗎？,19,1,1,1,0.8443300743990608
我想學習潛水或衝浪相關的課程，哪些初級課程比較適合？,19,1,1,1,0.7224238726092956
我對海洋休閒活動很有興趣，想知道有哪些課程可以學習初級潛水或衝浪？,19,1,1,1,0.3130068979353728
我想知道這個學程裡面有哪些課程跟水上運動或休閒活動有關？,19,1,1,1,0.7411899475152833
想了解更多海洋休閒運動的基礎知識，有哪些相關課程可以學習？,19,1,1,1,0.7151641988469146
我想學習潛水和帆船的基本技巧，哪些課程可以幫助我提升運動和健康能力？,19,1,1,1,0.8971698408230917
我想學習如何在海洋中進行休閒活動，例如潛水或衝浪，但不是完全初學者，有哪些課程適合我？,19,1,1,1,0.626410721142094
這個微學程好像很有趣，我想學習更多關於莎劇和文化的內容，有哪些課程能夠讓我更深入地了解這個領域？,9,1,1,1,0.03995644983234563
我對莎士比亞的作品很感興趣，有沒有提供與莎劇相關的課程或活動？,9,1,1,1,0.04005587504236954
我對莎劇和文化有興趣，但想知道有哪些課程可以學習莎劇與現代社會的關聯？,9,1,1,1,0.034246676961029655
我想了解國際素養課程的選修課，哪些比較有趣又實用？,9,0,0,0,0.012183292345884384
我對莎士比亞的作品很有興趣，還有關於文化詮釋的課程比較有趣？,9,1,1,1,0.11841751420948415
這個微學程有哪些選項比較有趣？有關於莎劇和文化的課程聽起來很吸引人。,9,1,1,1,0.15910329233944365
有關地球環境議題的課程很吸引我，能否介紹一下與氣候變遷或永續發展相關的課程？,9,0,1,1,0.03750335440133256
我對莎士比亞的作品很有興趣，還有其他相關課程嗎？,9,1,1,1,0.04170422414606011
想深入了解台日文化比較，我該選擇哪些課程？,23,1,1,1,0.2570355280675858
我想了解日本研究學程的課程選擇，目前有哪些比較有趣的選項？,23,0,1,1,0.057501455480243026
我對台灣和日本文化有很大的興趣，想知道這個學程有哪些課程可以讓我深入了解兩個國家的文化差異？,23,1,1,1,0.20403009499511238
我對台日文化比較研究很感興趣，有沒有可以提供更多資源或實際案例的課程？,23,1,1,1,0.18452686613828656
我想學習日本研究的相關課程，有沒有提供比較台灣與日本文化的課程？,23,1,1,1,0.2039987076650734
我對日本研究很有興趣，但想問一下，這些課程中有哪些是跟台灣文化比較研究相關的？,23,1,1,1,0.07884869600074498
我想了解台灣和日本的文化差異，哪些課程可以幫助我了解這兩個國家的社會和文化？,23,1,1,1,0.13680318927727508
我想了解更多關於日本和台灣文化的比較研究，有哪些課程可以幫助我深入了解這個領域？,23,1,1,1,0.13485055776740204
我對地方創生與區域治理有興趣，是否有課程探討台日文化比較或在地食物永續發展的議題？,13,1,1,1,0.47359047629212486
有關地方創生議題的研究，我想知道這個學程中，會探討哪些在地文化的實際案例？,13,1,1,1,0.16727385888581592
我想深入了解台日文化的比較研究，是否有相關的課程可以讓我學習？,13,1,1,1,0.2086920721829812
有關地方創生議題的探討，我想知道這個微學程是否會涵蓋與文化創意產業或在地餐飲相關的課程？,13,1,1,1,0.13527133139462147
我對台日文化比較有興趣，能不能推薦一些有關比較台日社會或文化的課程或研究方向？,13,1,1,1,0.2713528787796353
我對於台灣和日本的文化比較很有興趣，該學程有提供相關課程嗎？,13,1,1,1,0.25614004901653575
這個微學程似乎與在地文化和社會議題有關，我想知道這個學程的目標是什麼？是否能夠讓我了解更多關於台灣和日本的文化比較，以及在地發展的實踐？,13,1,1,1,0.08342557956336043
我對台日文化比較很有興趣，還有哪些課程可以學習台日文化的比較研究？,13,1,1,1,0.23011463678405086
我想了解如何用創作的方式去看待社會與文化，有哪些課程可以幫助我發展自己的故事創意？,17,0,1,1,0.018025808355517602
我想學習台灣的社會與文化，也有興趣了解地方文化的採集與應用，有哪些課程能夠讓我深入了解這些主題？,17,1,1,1,0.14751725998001144
這學程聽起來很有意思，我想深入了解地方文化和創意產業，有哪些課程可以幫助我學習如何將文化故事與數位技術結合起來？,17,0,0,0,0.006906425363325765
我對地方文化很感興趣，想知道學程的實踐課程是什麼樣子？有機會實際參與地方故事的挖掘和呈現嗎？,17,0,1,1,0.059361400023717925
我對地方文化很有興趣，想知道哪些課程能教會我如何收集和應用在地文化資源？,17,1,1,1,0.09957763321264607
我對於地方文化和創意產業很有興趣，有哪些課程可以教會我如何利用在地故事和文化創造新的內容和產品？,17,1,1,1,0.07991801123455643
我想了解台灣的社會文化和傳統，能不能給我一些建議或是推薦一些有關地方故事和文化的課程或實作項目？,17,1,1,1,0.11551832057966537
我對高雄的海洋文化很有興趣，能不能找一些課程或活動，能夠讓我深入了解高雄的海洋故事和文化？,17,1,1,1,0.04844509615918215
社區文創課程很吸引我，請問有哪些課程能教會我如何創造獨特的社區文化產品？,17,1,1,1,0.12988916602205586
這個學程好像結合了社區發展、文化創意和設計思考，我想了解更多關於社區文創的實際應用，有什麼樣的案例或專案可以參與嗎？,17,1,1,1,0.24415303900665156
我對台灣文化很有興趣，想知道有哪些課程可以了解台灣的社會、文化和海洋文化？,17,1,1,1,0.12082640525114915
我想了解社區文創的發展有哪些新趨勢？有沒有相關課程可以學習設計思考和社區創新？,17,1,1,1,0.25542716436161467
社區文創微學程很有趣，我想知道有沒有課程會教我如何設計一個創意的社區活動？,17,1,1,1,0.20770017379406017
我想在社區文創微學程中學習更多關於地方文化和創意設計，有哪些課程可以讓我了解台灣的海洋文化和觀光業？,17,1,1,1,0.1610821809166782
社區文創微學程似乎很有趣，我想了解社區文創設計的課程有哪些內容？,17,1,1,1,0.16243899328702005
我對台灣文化很感興趣，想知道有沒有課程可以學習台灣的歷史、海洋文化或地方創生？,17,1,1,1,0.12784874932279888
台日文化相差不遠，我想了解兩地的文化差異和相似之處，有哪些課程可以讓我深入了解？,5,1,1,1,0.06956094168470014
我對於台日兩國的文化比較很有興趣，有沒有可以讓我了解不同地域文化特色的課程？,5,1,1,1,0.22676058223368054
台日文化有很多不同之處，想知道台日文化比較研究的課程會-cover 哪些主題？,5,1,1,1,0.363427455056396
這個跨文化微學程很吸引我，我想了解更多台日文化的差異和相似之處，有沒有課程可以讓我深入探討？,5,1,1,1,0.2856300834662504
想比較台日兩地的文化差異，是否有相關課程可以學習？,5,0,1,1,0.076392890876504
我對台灣與日本文化有興趣，能否介紹一些比較兩國文化的課程或研究方向？,5,1,1,1,0.411402865507797
我想了解台日兩國的文化差異，有沒有課程可以學習比較台日兩地的社會習俗和宗教信仰？,5,1,1,1,0.09888598077472162
我對兩岸文化比較很感興趣，有沒有可以讓我從基礎學起的課程或者實踐計畫？,5,0,1,1,0.06565568286205495
我想知道這個微學程的課程內容有哪些與地方文化相關的課程？,10,1,1,1,0.16400473153351325
我對台灣文化很有興趣，有沒有課程可以學習如何使用數位工具創作故事或設計文化活動？,10,1,1,1,0.14620139482483588
有關台灣的文化和社會，我想知道有哪些課程可以幫助我更深入地了解這些議題？,10,1,1,1,0.2508323994114151
我想深入了解台灣的文化歷史和社會背景，有沒有提供關於台灣文化和地方故事的課程或實作機會？,10,1,1,1,0.14328649816895506
我對台灣的文化很有興趣，想知道有哪些課程可以讓我深入了解台灣的歷史和文化？,10,1,1,1,0.16572673796532345
這個微學程有關地方文化的課程，聽說有關故事創意與數位繪本的部分，看起來很有趣，是否可以跟導師討論一下有關數位媒體的應用？,10,1,1,1,0.10956910655879153
我想學習地方文化設計，想知道有哪些課程可以學習如何在社區中實踐文化設計？,10,1,1,1,0.1429320119472557
有沒有任何課程涉及故事創意與數位繪本的實作？,10,1,1,1,0.11550316423115414
我想參加地方創生與永續發展課程，但是有很多選擇，我該如何選擇適合自己的課程？,21,1,1,1,0.20063844971367306
我想學習如何整合地方創生和永續發展，有哪些相關的實踐案例可以參考嗎？,21,1,1,1,0.10279328223163726
我想了解如何結合地方創生與永續發展，能否推薦一些比較文化差異的課程？,21,1,1,1,0.2017272308251966
我對地方創生與永續發展有興趣，想知道哪些課程可以了解台日文化比較，以及如何透過建築工藝了解高雄的歷史？,21,1,1,1,0.22766426162543657
我對台日文化比較很感興趣，能夠參與哪些課程或專題研究，了解兩地文化差異與相似之處？,21,1,1,1,0.18962868335414104
對於地方創生與永續發展整合學程，想了解哪些課程與在地永續發展有直接關係？,21,1,1,1,0.21214269483620812
我想學習如何在地方創生中運用文化資源和永續發展的觀念，有哪些相關課程或實踐機會？,21,1,1,1,0.14188959693913206
我對地方創生和永續發展很感興趣，能否提供一些與台灣文化比較研究或在地食物永續發展相關的課程推薦？,21,1,1,1,0.07625561063226757
我對臺灣的文化與社會很有興趣，是否有任何推薦的課程或研究方向，讓我更深入地了解臺灣的社會背景與文化遺產？,34,1,1,1,0.09480064953121096
我對臺灣文化很感興趣，請問有哪些課程可以學習臺灣的社會、文化和歷史？,34,1,1,1,0.07692997017595112
我對臺灣的文化很感興趣，有哪些課程可以幫助我更深入地了解臺灣的社會、文化和歷史？,34,1,1,1,0.08544992246243518
我對臺灣的社會、文化和環境很感興趣，想知道有哪些課程可以讓我了解更多關於臺灣的海洋文化和生態問題？,34,0,0,0,0.03027891644497543
我對台灣的文化和社會很感興趣，想知道這個學程的課程有哪些相關的選項？,34,1,1,1,0.12371539154328381
我想深入了解臺灣社會與文化的多元面向，有哪些課程可以幫助我探索這方面的內容？,34,1,1,1,0.13772941161453725
我對台灣的文化和社會很感興趣，是否有相關的課程可以了解台灣社會和文化的變遷？,34,1,1,1,0.1260958070585217
有關台灣文化的課程很多，我想知道哪些課程可以幫助我深入了解台灣的社會文化？,34,1,1,1,0.12545539312618018
音樂劇實際上是什麼樣的演出形式？有哪些重要的表演技巧和技術需要學習？,13,1,1,1,0.45380640341462725
我對音樂劇很感興趣，想要知道如何提高自己的音樂劇演唱技巧和表演能力，有什麼課程可以幫助我提高這些方面的能力嗎？,13,1,1,1,0.41610688544159136
想加入音樂劇學程，但不知道從哪裡開始，能不能給我一些建議，哪些課程是最基礎的？,13,1,1,1,0.3658162634758226
我想加入音樂劇學程，但是不確定該選擇什麼樣的課程，能不能跟導師討論一下適合我的課程組合？,13,1,1,1,0.4020122453246144
我想參加音樂劇學程，但是不確定該如何選擇課程，有什麼建議可以幫助我更好地了解音樂劇表演的各個方面嗎？,13,1,1,1,0.3733133049751634
我想參加音樂劇學程，請問有任何課程介紹演唱技巧或合奏的內容嗎？,13,1,1,1,0.36559240487598177
音樂劇學程有很多課程，我想知道哪些課程對於演唱技巧的培養比較重要？,13,1,1,1,0.309029345855106
我想知道音樂劇表演與製作的課程，該如何選擇合適的演唱技巧和肢體訓練課程？,13,1,1,1,0.6079866799158791
我對莎士比亞的戲劇很有興趣，有沒有相關的選讀課程可以學習？,21,1,1,1,0.12440880774500415
我想學習更多關於莎士比亞的作品，哪些課程有相關的內容？,21,1,1,1,0.1303489107883155
我對法國文化和莎士比亞戲劇很感興趣，哪些課程可以讓我深入了解這些題目？,21,1,1,1,0.1350422333841994
我想學習法國語言和文化，但不確定該從哪裡開始，請問有哪些課程適合初學者？,21,1,1,1,0.17859189878220608
我想學習法文和莎士比亞的戲劇作品，請問有哪些課程能夠幫助我了解當代法國的文化與社會？,21,1,1,1,0.10717632950570695
我對莎士比亞戲劇很有興趣，能夠找到相關的選讀課程嗎？,21,1,1,1,0.1302721355678357
我想學習法國語言和文化，但不確定哪些課程適合初學者，有沒有推薦適合入門的課程？,21,1,1,1,0.17859189878220608
我想學習莎士比亞的戲劇作品，但不知道從哪裡開始，有推薦的選讀課程或相關資源嗎？,21,1,1,1,0.1326850187831037
我對台灣的海洋文化很感興趣，有沒有相關的課程可以學習？,6,1,1,1,0.05721001675256932
我對台灣的飲食文化很感興趣，有沒有課程可以讓我了解海洋文化對台灣飲食的影響？,6,1,1,1,0.19353035554653394
我對台灣文化和地方創生很有興趣，能否透過課程了解如何將故事和數位繪本融入在地發展？,6,1,1,1,0.2719111029058579
我對台灣海洋文化很有興趣，該學程有什麼課程可以讓我深入了解海洋文化的發展與在地應用嗎？,6,1,1,1,0.17143552951767693
我對台灣的海洋文化很有興趣，有沒有相關的課程可以了解海島生活和文化？,6,1,1,1,0.17397929170626011
我對於台灣的海洋文化很感興趣，能不能透過課程了解更多海洋文化的歷史和現代發展？,6,1,1,1,0.17250212398237286
這個微學程看起來很有趣，我想了解更多關於在地故事創作和數位繪本的課程內容，有什麼推薦的活動或課程嗎？,6,1,1,1,0.20476176341235178
有關於台灣在地文化的課程，聽說有個關於海洋文化的課程，能不能告訴我一下是什麼樣子的？,6,1,1,1,0.17030945485708063
我想學習更多關於台灣文化的英語課程，有沒有相關的微學程可以選擇？,4,1,1,1,0.06478720603526471
想深入了解台灣的文化故事，有沒有相關的課程可以學習古代中國的文學？,4,0,1,1,0.0350532635387671
我對高雄的歷史和建築很有興趣，有沒有相關的課程可以深入探索？,4,1,1,1,0.25136271841149666
這個微學程似乎很有趣，能不能告訴我，該學程會教學生如何分析和溝通台灣的文化資產？,4,0,0,0,0.004609710205116228
我對古代中國的文學很有興趣，古代中國的俠義、愛情和怪異書寫的課程有什麼內容？,4,1,1,1,0.25200041902497805
這個微學程的課程內容有趣，想知道是從哪些角度來分析古代中國文化的？,4,0,1,1,0.03009846597473118
我想了解學程裡面關於古代中國文化的部分，是否有相關的文學作品或故事會被教導給我們？,4,1,1,1,0.06548579218291538
我對古代中國的俠義文學很感興趣，是否有相關的課程可以學習？,4,1,1,1,0.051008054797187063
我想參加這個全英語通識教育菁英學程，但是有些課程名稱聽起來很複雜，有沒有簡單的說明或是選課建議？,12,1,1,1,0.06746875843020254
我想學習如何透過英語溝通去體驗不同文化，有哪些課程能夠讓我和朋友一起進行跨文化交流呢？,12,1,1,1,0.12907406810126082
我想學習外語並了解全球文化，有哪些課程能夠幫助我提高溝通能力和對不同文化的認識？,12,0,0,1,0.03434152539639149
我想參加全英語通識教育菁英學程，請問有哪些選課課程可以幫助我提高英語溝通能力和多元文化理解？,12,1,1,1,0.09285745754771997
我想了解全英語通識教育菁英學程的課程安排，能不能告訴我這個學程有哪些選擇？,12,0,0,0,0.026123251767404723
我想學習透過英語來理解不同文化的課程，有什麼選擇可以幫助我提高溝通能力？,12,0,1,1,0.06858199900766294
我想進一步了解課程內容，是否有機會安排實地參訪或交流活動，讓我們更深入了解全球文化？,12,1,1,1,0.07860735234051681
想學習透過實用性英語增進溝通能力，但不確定中級課程的難易程度，請教一下適合我的課程有哪些？,12,1,1,1,0.1035317636394913
我想了解跨文化的人文觀念和表演藝術，有什麼課程能夠幫助我深入了解這個領域嗎？,5,1,1,1,0.441665037471489
聽說這個微學程有關於人際關係和表演的課程，想知道這些課程會讓我們學到什麼樣的技巧和觀念？,5,0,0,0,0.014392280594257022
我想深入了解跨文化交往的表演藝術，是否有相關的課程可以學習跨文化溝通技巧和表演藝術？,5,0,1,1,0.07498565129138378
我對表演藝術很感興趣，想知道有哪些課程可以幫助我學習如何與不同文化的人溝通和互動？,5,1,1,1,0.21267041565053693
這個微學程的課程很有趣，有沒有跨文化交際或表演藝術的課程？,5,0,1,1,0.1132399375055612
我對於跨文化交往和表演藝術很有興趣，有什麼課程可以幫助我了解如何在不同文化背景下表達自己？,5,0,0,1,0.06354891106606372
這個微學程看起來很有趣，對於跨文化交流有什麼樣的課程或實驗？,5,0,0,0,0.021868034615939544
我對生命教育和環境劇場很感興趣，能否提供更多關於跨文化人文思潮和表演藝術的課程資訊？,5,1,1,1,0.7683333333333333
想深入了解人權議題，哪些課程能夠讓我了解人權倡議的實踐和挑戰？,4,1,1,1,0.506359525155455
人權研究整合學程似乎很廣泛，我想知道這個學程主要是學習什麼樣的議題或能力？,4,1,1,1,0.08593142534752232
人權研究整合學程很吸引我，能否告訴我在學程中有哪些課程關於人權倡議和社會變遷的內容？,4,1,1,1,0.2990786773989899
